{
  "$schema": "https://json-schema.org/draft/2020-12/schema",
  "$id": "https://bobbycats.github.io/ai-dev-runtime-protocol/schemas/requirement-brief.schema.json",
  "title": "RequirementBrief",
  "type": "object",
  "required": [
    "schema_version",
    "brief_id",
    "generated_at",
    "title",
    "product_idea",
    "target_users",
    "pain_points",
    "desired_outcomes",
    "core_scenarios"
  ],
  "properties": {
    "schema_version": { "type": "string" },
    "brief_id": { "type": "string" },
    "generated_at": { "type": "string" },
    "title": { "type": "string" },
    "product_idea": { "type": "string" },
    "target_users": { "type": "array", "items": { "type": "string" } },
    "pain_points": { "type": "array", "items": { "type": "string" } },
    "desired_outcomes": { "type": "array", "items": { "type": "string" } },
    "core_scenarios": { "type": "array", "items": { "type": "string" } },
    "non_goals": { "type": "array", "items": { "type": "string" } },
    "constraints": { "type": "array", "items": { "type": "string" } },
    "success_metrics": { "type": "array", "items": { "type": "string" } },
    "open_questions": { "type": "array", "items": { "type": "string" } },
    "assumptions": { "type": "array", "items": { "type": "string" } },
    "recommended_next_step": { "type": "string" }
  }
}
