{
  "schema_version": "0.1.0",
  "brief_id": "ai-会议助手第一版",
  "generated_at": "2026-03-20T18:50:32+00:00",
  "title": "AI 会议助手第一版",
  "product_idea": "把模糊会议安排需求收敛成结构化计划，再交给用户确认和执行。",
  "target_users": [
    "高频安排评审会和同步会的团队负责人"
  ],
  "pain_points": [
    "会议安排总在聊天里反复改，最后没人能准确回答到底定在哪个时间"
  ],
  "desired_outcomes": [
    "先得到一份范围稳定的第一版简报"
  ],
  "core_scenarios": [
    "通过聊天创建、改期和删除会议",
    "在删除前给出可确认的计划"
  ],
  "non_goals": [
    "第一版不做外部日历双向同步"
  ],
  "constraints": [
    "第一版只处理团队内部会议"
  ],
  "success_metrics": [
    "能稳定生成 task-packet 并指导后续实现"
  ],
  "open_questions": [],
  "assumptions": [
    "默认用户更在意收敛速度而不是花哨交互"
  ],
  "recommended_next_step": "Run product review first, then engineering review, and only convert to a task-packet after scope is stable. | 先过产品评审和工程评审，范围稳定后再转成 task-packet | 任务包。"
}
